{
  "id": "AST08",
  "name": "Poor Scanning",
  "source_list": "AST-Top10-2026",
  "version": "2026-Q3",
  "severity": "Medium",
  "aivss_score": null,
  "audience": [
    "security-engineer",
    "red-teamer",
    "ciso",
    "auditor"
  ],
  "mappings": [
    {
      "framework": "MAESTRO",
      "control_id": "L5",
      "control_name": "Evaluation & Observability",
      "tier": "Foundational",
      "scope": "Both",
      "notes": "DRAFT — SME review required",
      "framework_version": "MAESTRO 1.0",
      "confidence": "unreviewed",
      "reviewed_by": [],
      "evidence_count": 0,
      "evidence": {
        "confirmed": [],
        "drafted": [
          "INC-121",
          "INC-128",
          "INC-129"
        ]
      }
    },
    {
      "framework": "MAESTRO",
      "control_id": "L6",
      "control_name": "Security & Compliance",
      "tier": "Foundational",
      "scope": "Both",
      "notes": "DRAFT — SME review required",
      "framework_version": "MAESTRO 1.0",
      "confidence": "unreviewed",
      "reviewed_by": []
    },
    {
      "framework": "MAESTRO",
      "control_id": "L3",
      "control_name": "Agent Frameworks",
      "tier": "Foundational",
      "scope": "Both",
      "notes": "DRAFT — SME review required",
      "framework_version": "MAESTRO 1.0",
      "confidence": "unreviewed",
      "reviewed_by": []
    }
  ],
  "tools": [],
  "incidents": [
    {
      "name": "Actively malicious OpenClaw skills in use by 6,000+ users, flagged by a skill scanner",
      "url": "https://github.com/GenAI-Security-Project/crosswalk/blob/main/data/incidents.json",
      "year": 2026,
      "incident_id": "INC-117"
    },
    {
      "name": "Pattern-matching skill scanners miss the majority of critical threats",
      "url": "https://github.com/GenAI-Security-Project/crosswalk/blob/main/data/incidents.json",
      "year": 2026,
      "incident_id": "INC-121"
    },
    {
      "name": "Every public skill scanner bypassed in under an hour (Trail of Bits)",
      "url": "https://github.com/GenAI-Security-Project/crosswalk/blob/main/data/incidents.json",
      "year": 2026,
      "incident_id": "INC-128"
    },
    {
      "name": "The Story of Skills — a malicious skill reaches 26,000 agents past every scanner",
      "url": "https://github.com/GenAI-Security-Project/crosswalk/blob/main/data/incidents.json",
      "year": 2026,
      "incident_id": "INC-129"
    }
  ],
  "crossrefs": {},
  "changelog": [
    {
      "date": "2026-03-27",
      "version": "1.0.0",
      "change": "Initial entry — generated from OWASP GenAI Crosswalk v1.5.1 mapping files",
      "author": "OWASP GenAI Data Security Initiative"
    },
    {
      "date": "2026-08-28",
      "version": "1.0.0",
      "change": "Registered by T-A10-01. Name and severity transcribed from owasp.org/www-project-agentic-skills-top-10/ (verified 2026-08-28). Mappings are authored by an SME under T-A10-03 and are deliberately empty.",
      "author": "OWASP GenAI Data Security Initiative"
    }
  ]
}