{
  "id": "AST04",
  "name": "Insecure Metadata",
  "source_list": "AST-Top10-2026",
  "version": "2026-Q3",
  "severity": "High",
  "aivss_score": null,
  "audience": [
    "security-engineer",
    "red-teamer",
    "ciso",
    "auditor"
  ],
  "mappings": [
    {
      "framework": "MAESTRO",
      "control_id": "L7",
      "control_name": "Agent Ecosystem",
      "tier": "Foundational",
      "scope": "Both",
      "notes": "DRAFT — SME review required",
      "framework_version": "MAESTRO 1.0",
      "confidence": "unreviewed",
      "reviewed_by": [],
      "evidence_count": 0,
      "evidence": {
        "confirmed": [],
        "drafted": [
          "INC-116",
          "INC-120"
        ]
      }
    },
    {
      "framework": "MAESTRO",
      "control_id": "L3",
      "control_name": "Agent Frameworks",
      "tier": "Foundational",
      "scope": "Both",
      "notes": "DRAFT — SME review required",
      "framework_version": "MAESTRO 1.0",
      "confidence": "unreviewed",
      "reviewed_by": []
    },
    {
      "framework": "MAESTRO",
      "control_id": "L4",
      "control_name": "Deployment & Infrastructure",
      "tier": "Foundational",
      "scope": "Both",
      "notes": "DRAFT — SME review required",
      "framework_version": "MAESTRO 1.0",
      "confidence": "unreviewed",
      "reviewed_by": [],
      "evidence_count": 0,
      "evidence": {
        "confirmed": [],
        "drafted": [
          "INC-116"
        ]
      }
    },
    {
      "framework": "MAESTRO",
      "control_id": "L6",
      "control_name": "Security & Compliance",
      "tier": "Foundational",
      "scope": "Both",
      "notes": "DRAFT — SME review required",
      "framework_version": "MAESTRO 1.0",
      "confidence": "unreviewed",
      "reviewed_by": [],
      "evidence_count": 0,
      "evidence": {
        "confirmed": [],
        "drafted": [
          "INC-123"
        ]
      }
    }
  ],
  "tools": [],
  "incidents": [
    {
      "name": "SKILL.md to shell access in three lines of markdown (Snyk threat model)",
      "url": "https://github.com/GenAI-Security-Project/GenAI-Data-Security-Initiative/blob/main/crosswalk/data/incidents.json",
      "year": 2026,
      "incident_id": "INC-116"
    },
    {
      "name": "Brand-impersonating skill on ClawHub tricks users into installing malware",
      "url": "https://github.com/GenAI-Security-Project/GenAI-Data-Security-Initiative/blob/main/crosswalk/data/incidents.json",
      "year": 2026,
      "incident_id": "INC-120"
    },
    {
      "name": "OpenClaw log poisoning — agent logs as an indirect prompt injection channel",
      "url": "https://github.com/GenAI-Security-Project/GenAI-Data-Security-Initiative/blob/main/crosswalk/data/incidents.json",
      "year": 2026,
      "incident_id": "INC-122"
    },
    {
      "name": "Claude Code repository config execution before trust dialog (CVE-2025-59536, CVE-2026-21852)",
      "url": "https://github.com/GenAI-Security-Project/GenAI-Data-Security-Initiative/blob/main/crosswalk/data/incidents.json",
      "year": 2026,
      "incident_id": "INC-123"
    }
  ],
  "crossrefs": {},
  "changelog": [
    {
      "date": "2026-03-27",
      "version": "1.0.0",
      "change": "Initial entry — generated from OWASP GenAI Crosswalk v1.5.1 mapping files",
      "author": "OWASP GenAI Data Security Initiative"
    },
    {
      "date": "2026-08-28",
      "version": "1.0.0",
      "change": "Registered by T-A10-01. Name and severity transcribed from owasp.org/www-project-agentic-skills-top-10/ (verified 2026-08-28). Mappings are authored by an SME under T-A10-03 and are deliberately empty.",
      "author": "OWASP GenAI Data Security Initiative"
    }
  ]
}