{
  "id": "AST02",
  "name": "Supply Chain Compromise",
  "source_list": "AST-Top10-2026",
  "version": "2026-Q3",
  "severity": "Critical",
  "aivss_score": null,
  "audience": [
    "security-engineer",
    "red-teamer",
    "ciso",
    "auditor"
  ],
  "mappings": [
    {
      "framework": "MAESTRO",
      "control_id": "L7",
      "control_name": "Agent Ecosystem",
      "tier": "Foundational",
      "scope": "Both",
      "notes": "DRAFT — SME review required",
      "framework_version": "MAESTRO 1.0",
      "confidence": "unreviewed",
      "reviewed_by": []
    },
    {
      "framework": "MAESTRO",
      "control_id": "L3",
      "control_name": "Agent Frameworks",
      "tier": "Foundational",
      "scope": "Both",
      "notes": "DRAFT — SME review required",
      "framework_version": "MAESTRO 1.0",
      "confidence": "unreviewed",
      "reviewed_by": []
    },
    {
      "framework": "MAESTRO",
      "control_id": "L6",
      "control_name": "Security & Compliance",
      "tier": "Foundational",
      "scope": "Both",
      "notes": "DRAFT — SME review required",
      "framework_version": "MAESTRO 1.0",
      "confidence": "unreviewed",
      "reviewed_by": []
    },
    {
      "framework": "MAESTRO",
      "control_id": "L4",
      "control_name": "Deployment & Infrastructure",
      "tier": "Foundational",
      "scope": "Both",
      "notes": "DRAFT — SME review required",
      "framework_version": "MAESTRO 1.0",
      "confidence": "unreviewed",
      "reviewed_by": []
    }
  ],
  "tools": [],
  "incidents": [
    {
      "name": "ClawHavoc — 1,184 malicious skills flooded onto the ClawHub registry",
      "url": "https://github.com/GenAI-Security-Project/crosswalk/blob/main/data/incidents.json",
      "year": 2026,
      "incident_id": "INC-115"
    },
    {
      "name": "Claude Code repository config execution before trust dialog (CVE-2025-59536, CVE-2026-21852)",
      "url": "https://github.com/GenAI-Security-Project/crosswalk/blob/main/data/incidents.json",
      "year": 2026,
      "incident_id": "INC-123"
    }
  ],
  "crossrefs": {},
  "changelog": [
    {
      "date": "2026-03-27",
      "version": "1.0.0",
      "change": "Initial entry — generated from OWASP GenAI Crosswalk v1.5.1 mapping files",
      "author": "OWASP GenAI Data Security Initiative"
    },
    {
      "date": "2026-08-28",
      "version": "1.0.0",
      "change": "Registered by T-A10-01. Name and severity transcribed from owasp.org/www-project-agentic-skills-top-10/ (verified 2026-08-28). Mappings are authored by an SME under T-A10-03 and are deliberately empty.",
      "author": "OWASP GenAI Data Security Initiative"
    }
  ]
}