{
  "id": "AST07",
  "name": "Update Drift",
  "source_list": "AST-Top10-2026",
  "version": "2026-Q3",
  "severity": "Medium",
  "aivss_score": null,
  "audience": [
    "security-engineer",
    "red-teamer",
    "ciso",
    "auditor"
  ],
  "mappings": [
    {
      "framework": "MAESTRO",
      "control_id": "L4",
      "control_name": "Deployment & Infrastructure",
      "tier": "Foundational",
      "scope": "Both",
      "notes": "DRAFT — SME review required",
      "framework_version": "MAESTRO 1.0",
      "confidence": "unreviewed",
      "reviewed_by": []
    },
    {
      "framework": "MAESTRO",
      "control_id": "L6",
      "control_name": "Security & Compliance",
      "tier": "Foundational",
      "scope": "Both",
      "notes": "DRAFT — SME review required",
      "framework_version": "MAESTRO 1.0",
      "confidence": "unreviewed",
      "reviewed_by": [],
      "evidence_count": 0,
      "evidence": {
        "confirmed": [],
        "drafted": [
          "INC-124"
        ]
      }
    },
    {
      "framework": "MAESTRO",
      "control_id": "L7",
      "control_name": "Agent Ecosystem",
      "tier": "Foundational",
      "scope": "Both",
      "notes": "DRAFT — SME review required",
      "framework_version": "MAESTRO 1.0",
      "confidence": "unreviewed",
      "reviewed_by": [],
      "evidence_count": 0,
      "evidence": {
        "confirmed": [],
        "drafted": [
          "INC-131"
        ]
      }
    }
  ],
  "tools": [],
  "incidents": [
    {
      "name": "ClawJacked — any website could take over a local OpenClaw agent via its localhost WebSocket",
      "url": "https://github.com/GenAI-Security-Project/GenAI-Data-Security-Initiative/blob/main/crosswalk/data/incidents.json",
      "year": 2026,
      "incident_id": "INC-124"
    },
    {
      "name": "SkillJacking — 925 skills sit on instantly hijackable dependencies",
      "url": "https://github.com/GenAI-Security-Project/GenAI-Data-Security-Initiative/blob/main/crosswalk/data/incidents.json",
      "year": 2026,
      "incident_id": "INC-131"
    }
  ],
  "crossrefs": {},
  "changelog": [
    {
      "date": "2026-03-27",
      "version": "1.0.0",
      "change": "Initial entry — generated from OWASP GenAI Crosswalk v1.5.1 mapping files",
      "author": "OWASP GenAI Data Security Initiative"
    },
    {
      "date": "2026-08-28",
      "version": "1.0.0",
      "change": "Registered by T-A10-01. Name and severity transcribed from owasp.org/www-project-agentic-skills-top-10/ (verified 2026-08-28). Mappings are authored by an SME under T-A10-03 and are deliberately empty.",
      "author": "OWASP GenAI Data Security Initiative"
    }
  ]
}